{"corpus_hash":"3c2551a9c3db638fad77893093ed15ece6569d468f201387bec7ecf64ae66a40","executed_case_ids":["ADMIN-WITHDRAW-ALICE-5","DEPOSIT-ALICE-100","DEPOSIT-BOB-40","PAUSE-OFF","PAUSE-ON","WITHDRAW-ALICE-10-AFTER-PAUSE","WITHDRAW-ALICE-20"],"executor":"local-hardhat","generated_at":"2026-09-24T00:00:00.000Z","independent_ci_run":null,"missing_case_ids":[],"note":"Generated from local EVM execution. No independent hosted CI run is claimed.","report_file":"invariant-break.json","report_hash":"b2bfb7e37f30a03e6be367a3f37e12b45a06547dc5343cdc583563671a42e03a","required_case_ids":["ADMIN-WITHDRAW-ALICE-5","DEPOSIT-ALICE-100","DEPOSIT-BOB-40","PAUSE-OFF","PAUSE-ON","WITHDRAW-ALICE-10-AFTER-PAUSE","WITHDRAW-ALICE-20"],"schema_version":"1","transaction_count":7}