{"corpus_hash":"3c2551a9c3db638fad77893093ed15ece6569d468f201387bec7ecf64ae66a40","executed_case_ids":["ADMIN-WITHDRAW-ALICE-5","DEPOSIT-ALICE-100","DEPOSIT-BOB-40","PAUSE-ON","WITHDRAW-ALICE-10-AFTER-PAUSE","WITHDRAW-ALICE-20"],"executor":"local-hardhat","generated_at":"2026-09-24T00:00:00.000Z","independent_ci_run":null,"missing_case_ids":["PAUSE-OFF"],"note":"Generated from local EVM execution. No independent hosted CI run is claimed.","report_file":"incomplete-replay.json","report_hash":"19d2291048444b68333893e9db79f8647626acf482738715725309c68ab5c068","required_case_ids":["ADMIN-WITHDRAW-ALICE-5","DEPOSIT-ALICE-100","DEPOSIT-BOB-40","PAUSE-OFF","PAUSE-ON","WITHDRAW-ALICE-10-AFTER-PAUSE","WITHDRAW-ALICE-20"],"schema_version":"1","transaction_count":6}